{
 "format": "hiana-course@1",
 "slug": "itprnn",
 "title": "The Information Theory, Pattern Recognition, and Neural Networks",
 "category": "数学进阶",
 "provider": "Cambridge",
 "instructors": [],
 "language": "Anything would be OK, Python preferred",
 "prerequisites": "Calculus, Linear Algebra, Probabilities and Statistics",
 "difficulty": 3,
 "hours": "30-50 小时",
 "summary": "剑桥大学 Sir David MacKay 教授的信息论课程。教授是一位十分精通信息论与神经网络的学者，课程对应教材也是信息论领域的一部经典著作。可惜天妒英才...",
 "tags": [],
 "license": "介绍文字 © csdiy.wiki，MIT 许可",
 "intro": {
  "community": "## 课程简介\n\n剑桥大学 Sir David MacKay 教授的信息论课程。教授是一位十分精通信息论与神经网络的学者，课程对应教材也是信息论领域的一部经典著作。可惜天妒英才...\n\n## 课程资源\n\n- 课程网站：<http://www.inference.org.uk/mackay/itila/>\n- 课程视频：<https://www.bilibili.com/video/BV1rs411T71e>\n- 课程教材：Information Theory, Inference, and Learning Algorithms 在课程网站可以下载到免费的电子版\n- 课程作业：在每一节课视频的最后会留教材上的课后习题\n\n## R.I.P Prof. David MacKay\n",
  "communitySource": {
   "kind": "website",
   "label": "csdiy.wiki",
   "url": "https://csdiy.wiki/%E6%95%B0%E5%AD%A6%E8%BF%9B%E9%98%B6/The_Information_Theory_Pattern_Recognition_and_Neural_Networks/"
  }
 },
 "links": [
  {
   "kind": "website",
   "label": "网站",
   "url": "http://www.inference.org.uk/mackay/itila/"
  },
  {
   "kind": "video",
   "label": "视频",
   "url": "https://www.bilibili.com/video/BV1rs411T71e"
  }
 ],
 "modules": [],
 "titleEn": "The Information Theory, Pattern Recognition, and Neural Networks"
}
