{
 "format": "hiana-course@1",
 "slug": "mit6-824",
 "title": "MIT 6.5840 (原 6.824): Distributed System",
 "category": "并行与分布式系统",
 "provider": "MIT",
 "instructors": [],
 "language": "Go",
 "prerequisites": "计算机体系结构，并行编程",
 "difficulty": 5,
 "hours": "200 小时",
 "summary": "这门课自 2023 年春季学期起，课程编号由 6.824 变更为 6.5840，课程内容保持不变。",
 "tags": [],
 "license": "介绍文字 © csdiy.wiki，MIT 许可",
 "intro": {
  "community": "## 课程简介\n\n这门课自 2023 年春季学期起，课程编号由 6.824 变更为 6.5840，课程内容保持不变。\n\n这门课和 MIT 6.S081 一样，出品自 MIT 大名鼎鼎的 PDOS 实验室，授课老师 Robert Morris 教授曾是一位顶尖黑客，世界上第一个蠕虫病毒 Morris 病毒就是出自他之手。\n\n这门课每节课都会精读一篇分布式系统领域的经典论文，并由此传授分布式系统设计与实现的重要原则和关键技术。同时其课程 Project 也是以其难度之大而闻名遐迩，5 个编程作业循序渐进带你实现一个基于 Raft 共识算法的 KV-store 框架，让你在痛苦的 debug 中体会并行与分布式带来的随机性和复杂性。\n\n同样，这门课由于太过出名，网上答案无数，希望大家不要参考，而是力图自主实现整个 Project。\n\n## 课程资源\n\n- 课程网站：<https://pdos.csail.mit.edu/6.5840/schedule.html>\n- 课程视频：参见课程网站链接\n- 课程视频中文翻译：<https://mit-public-courses-cn-translatio.gitbook.io/mit6-824/>\n- 课程教材：无，以阅读论文为主\n- 课程作业：5 个非常虐的 Project，具体要求参见课程网站\n\n## 资源汇总\n\n@PKUFlyingPig 在学习这门课中用到的所有资源和作业实现都汇总在 [PKUFlyingPig/MIT6.824 - GitHub](https://github.com/PKUFlyingPig/MIT6.824) 中。\n\n@[OneSizeFitsQuorum](https://github.com/OneSizeFitsQuorum) 的 [Lab 文档](https://github.com/OneSizeFitsQuorum/MIT6.824-2021) 较为清晰地介绍了实现 lab 1-4 和 challenge 1-2 时需要考虑的许多细节，在遇到瓶颈期时可以阅读一下~~\n",
  "communitySource": {
   "kind": "website",
   "label": "csdiy.wiki",
   "url": "https://csdiy.wiki/%E5%B9%B6%E8%A1%8C%E4%B8%8E%E5%88%86%E5%B8%83%E5%BC%8F%E7%B3%BB%E7%BB%9F/MIT6.824/"
  },
  "official": "6.5840 是一门核心的 12 学分研究生课程，涵盖分布式系统的抽象概念和实现技术。课程重点关注容错、复制和一致性，并通过真实分布式系统的案例研究进行深入研究。课程包括 5 个实践编程实验（MapReduce、键值服务器、Raft 共识、分片等）、讲座、阅读和考试。",
  "officialSource": {
   "kind": "website",
   "label": "pdos.csail.mit.edu",
   "url": "https://pdos.csail.mit.edu/6.5840/"
  }
 },
 "links": [
  {
   "kind": "website",
   "label": "课程网站",
   "url": "https://pdos.csail.mit.edu/6.5840/"
  },
  {
   "kind": "website",
   "label": "网站",
   "url": "https://pdos.csail.mit.edu/6.5840/schedule.html"
  },
  {
   "kind": "video",
   "label": "视频中文翻译",
   "url": "https://mit-public-courses-cn-translatio.gitbook.io/mit6-824/"
  }
 ],
 "modules": [],
 "titleEn": "MIT 6.5840: Distributed Systems"
}
