{
 "format": "hiana-course@1",
 "slug": "nn-zero-to-hero",
 "title": "神经网络：从零到英雄",
 "category": "人工智能",
 "provider": "Andrej Karpathy",
 "instructors": [],
 "language": "",
 "prerequisites": "",
 "difficulty": 0,
 "hours": "",
 "summary": "本课程由 Andrej Karpathy 讲授，是一个深入浅出的深度学习课程，旨在帮助学习者掌握神经网络的核心原理。课程从基础概念（如反向传播和 micrograd）入手，逐步带领学员构建语言模型、WaveNet，并从零开始实现 GPT。课程以实践为主……",
 "tags": [],
 "license": "介绍文字 © csdiy.wiki，MIT 许可",
 "intro": {
  "community": "## 课程简介  \n\n- <strong>讲师：</strong> Andrej Karpathy  \n- <strong>先修要求：</strong> 具备基本的 Python 编程能力，并对深度学习概念有所了解  \n- <strong>编程语言：</strong> Python  \n- <strong>难度：</strong> 🌟🌟🌟🌟  \n- <strong>课程时长：</strong> 约 19 小时  \n\n本课程由 Andrej Karpathy 讲授，是一个深入浅出的深度学习课程，旨在帮助学习者掌握神经网络的核心原理。课程从基础概念（如反向传播和 micrograd）入手，逐步带领学员构建语言模型、WaveNet，并从零开始实现 GPT。课程以实践为主，提供逐步讲解的代码示例，让学员能够理解并构建复杂的神经网络模型。  \n\n## 讲师信息  \n\nAndrej Karpathy 是一位知名的人工智能研究员和教育者，在深度学习和神经网络领域具有丰富的经验。他曾在 <strong>2017 至 2022 年担任特斯拉 AI 部门高级总监</strong>，领导 <strong>Tesla Autopilot 计算机视觉团队</strong>，负责数据标注、神经网络训练、部署等工作。在此之前，他曾是 <strong>OpenAI 的研究科学家和创始成员</strong>（2015-2017）。2023 年，他回归 OpenAI，参与改进 ChatGPT 的 GPT-4。2024 年，他创立了 <strong>Eureka Labs</strong>，一家专注于 AI + 教育的公司。  \n\nKarpathy 拥有 <strong>斯坦福大学博士学位</strong>，师从 <strong>Fei-Fei Li（李飞飞）</strong>，主要研究卷积神经网络和循环神经网络及其在计算机视觉和自然语言处理中的应用。他曾与 <strong>Daphne Koller、Andrew Ng（吴恩达）、Sebastian Thrun 和 Vladlen Koltun</strong> 等知名研究员合作。此外，他还在斯坦福大学教授了首个深度学习课程 <strong>CS 231n: 卷积神经网络与视觉识别</strong>，该课程逐渐发展为斯坦福大学规模最大的课程之一。  \n\n## 课程资源  \n\n- <strong>课程视频：</strong> [YouTube 播放列表](https://www.youtube.com/watch?v=VMj-3S1tku0&list=PLAqhIrjkxbuWI23v9cThsA9GvCAUhRvKZ)  \n- <strong>作业：</strong> 课程中提供的代码实践和项目练习  \n\n更多信息请访问 YouTube 观看完整课程视频。\n",
  "communitySource": {
   "kind": "website",
   "label": "csdiy.wiki",
   "url": "https://csdiy.wiki/%E4%BA%BA%E5%B7%A5%E6%99%BA%E8%83%BD/Neural%20Networks%EF%BC%9AZero%20to%20Hero/"
  },
  "official": "本课程由 Andrej Karpathy 讲授，是一个深入浅出的深度学习课程，旨在帮助学习者掌握神经网络的核心原理。课程从基础概念（如反向传播和 micrograd）入手，逐步带领学员构建语言模型、WaveNet，并从零开始实现 GPT。课程以实践为主，提供逐步讲解的代码示例，让学员能够理解并构建复杂的神经网络模型。课程约需 19 小时，难度为中高水平。"
 },
 "links": [
  {
   "kind": "video",
   "label": "<strong>课程视频 · YouTube 播放列表",
   "url": "https://www.youtube.com/watch?v=VMj-3S1tku0&list=PLAqhIrjkxbuWI23v9cThsA9GvCAUhRvKZ"
  }
 ],
 "modules": []
}
