{
 "format": "hiana-course@1",
 "slug": "ustc-cg",
 "title": "USTC Computer Graphics",
 "category": "计算机图形学",
 "provider": "中国科学技术大学",
 "instructors": [],
 "language": "C/C++",
 "prerequisites": "微积分，线性代数，C/C++编程，数据结构",
 "difficulty": 3,
 "hours": "100小时",
 "summary": "课程简介",
 "tags": [],
 "license": "介绍文字 © csdiy.wiki，MIT 许可",
 "intro": {
  "community": "# USTC Computer Graphics\r\n\r\n## 课程简介\r\n\r\n- 所属大学：中国科学技术大学\r\n- 先修要求：微积分，线性代数，C/C++编程，数据结构\r\n- 编程语言：C/C++\r\n- 课程难度：🌟🌟🌟\r\n- 预计学时：100小时\r\n\r\n中科大数学学院的刘利刚老师在20年疫情期间上传的课程，个人感觉跟 Games101 的注重渲染相比在内容上更全面，有着后者所没有的离散几何处理等内容，看起来更加数学化，可以与 Games101 进行互补，课程资料全面公开。\r\n\r\n## 课程资源\r\n\r\n- 课程网站：http://staff.ustc.edu.cn/~lgliu/Courses/ComputerGraphics_2020_spring-summer/default.htm\r\n- 课程视频：https://www.bilibili.com/video/BV1iT4y1o7oM/?spm_id_from=333.880.my_history.page.click&vd_source=eea47a16439992e41b232bc5d5684e27\r\n- 课程教材：本课程不规定使用规定教材，以学术前沿论文为主，以下教材仅仅为参考 E. Angel, Interactive Computer Graphics — A top-down approach using OpenGL™, 6th ed., 2011. （中文翻译版：交互式计算机图形学—基于 OpenGL 的自顶向下方法（第五版），电子工业出版社，2012）\r\n- 课程作业：http://staff.ustc.edu.cn/~lgliu/Courses/ComputerGraphics_2020_spring-summer/default.htm ，九个作业加一个 Project ，具体看官网\n",
  "communitySource": {
   "kind": "website",
   "label": "csdiy.wiki",
   "url": "https://csdiy.wiki/%E8%AE%A1%E7%AE%97%E6%9C%BA%E5%9B%BE%E5%BD%A2%E5%AD%A6/USTC%20ComputerGraphics/"
  }
 },
 "links": [
  {
   "kind": "assignments",
   "label": "作业",
   "url": "http://staff.ustc.edu.cn/~lgliu/Courses/ComputerGraphics_2020_spring-summer/default.htm"
  }
 ],
 "modules": [],
 "titleEn": "Computer Graphics"
}
