{
 "format": "hiana-course@1",
 "slug": "n2t",
 "title": "Coursera: Nand2Tetris",
 "category": "体系结构",
 "provider": "希伯来大学",
 "instructors": [],
 "language": "任选一个编程语言",
 "prerequisites": "无",
 "difficulty": 3,
 "hours": "40 小时",
 "summary": "Coursera 上被数万人评为满分，在全球四百多所高校、高中被采用，让一个完全没有计算机基础的人从与非门开始造一台计算机，并在上面运行俄罗斯方块小游戏。",
 "tags": [],
 "license": "介绍文字 © csdiy.wiki，MIT 许可",
 "intro": {
  "community": "## 课程简介\n\n[Coursera](https://www.coursera.org) 上被数万人评为满分，在全球四百多所高校、高中被采用，让一个完全没有计算机基础的人从与非门开始造一台计算机，并在上面运行俄罗斯方块小游戏。\n\n听起来就很酷对不对？实现起来更酷！这门课分为硬件和软件两个部分。在硬件部分，你将进入 01 的世界，用与非门构造出逻辑电路，并逐步搭建出一个 CPU 来运行一套课程作者定义的简易汇编代码。在软件部分，你将编写一个编译器，将作者开发的一个名为Jack的高级语言编译为可以运行在虚拟机上的字节码，然后进一步翻译为汇编代码。你还将开发一个简易的 OS，让你的计算机支持输入输出图形界面。至此，你可以用 Jack 开发一个俄罗斯方块的小游戏，将它编译为汇编代码，运行在你用与非门搭建出的 CPU 上，通过你开发的 OS 进行交互。学完这门课程，你将对整个计算机的体系结构有一个全局且深刻的理解，对于你后续课程的学习有着莫大的帮助。\n\n你也许会担心课程会不会很难，但这门课面向的人群是完全没有计算机基础的人，课程作者的目标是让高中生都能理解。因此，只要你按部就班跟着课程规划走，一个月内学完应该绰绰有余。麻雀虽小但是五脏俱全，这门课很好地提取出了计算机的本质，而不过多地陷于现代计算机为了性能而设计出的众多复杂细节。让学习者能在轻松愉快的学习体验中感受计算机的优雅与神奇。\n\n## 课程资源\n\n- 课程网站：[Nand2Tetris I](https://www.coursera.org/learn/build-a-computer/home/week/1), [Nand2Tetris II](https://www.coursera.org/learn/nand2tetris2/home/welcome)\n- 课程视频：详见课程网站\n- 课程教材：[计算机系统要素：从零开始构建现代计算机][book]\n- 课程作业：10 个 Project 带你造台计算机，具体要求详见课程网站\n\n[book]: https://github.com/PKUFlyingPig/NandToTetris/blob/master/%5B%E8%AE%A1%E7%AE%97%E6%9C%BA%E7%B3%BB%E7%BB%9F%E8%A6%81%E7%B4%A0%EF%BC%9A%E4%BB%8E%E9%9B%B6%E5%BC%80%E5%A7%8B%E6%9E%84%E5%BB%BA%E7%8E%B0%E4%BB%A3%E8%AE%A1%E7%AE%97%E6%9C%BA%5D.(%E5%B0%BC%E8%90%A8).%E5%91%A8%E7%BB%B4.%E6%89%AB%E6%8F%8F%E7%89%88.pdf\n\n## 资源汇总\n\n@PKUFlyingPig 在学习这门课中用到的所有资源和作业实现都汇总在 [PKUFlyingPig/NandToTetris - GitHub](https://github.com/PKUFlyingPig/NandToTetris) 中。\n",
  "communitySource": {
   "kind": "website",
   "label": "csdiy.wiki",
   "url": "https://csdiy.wiki/%E4%BD%93%E7%B3%BB%E7%BB%93%E6%9E%84/N2T/"
  }
 },
 "links": [
  {
   "kind": "website",
   "label": "网站 · Nand2Tetris I",
   "url": "https://www.coursera.org/learn/build-a-computer/home/week/1"
  },
  {
   "kind": "website",
   "label": "网站 · Nand2Tetris II",
   "url": "https://www.coursera.org/learn/nand2tetris2/home/welcome"
  }
 ],
 "modules": [],
 "titleEn": "Nand2Tetris"
}
