{
 "format": "hiana-course@1",
 "slug": "mit6-s081",
 "title": "MIT 6.1810 (原 6.S081): Operating System Engineering",
 "category": "操作系统",
 "provider": "麻省理工学院",
 "instructors": [],
 "language": "C, RISC-V",
 "prerequisites": "体系结构 + 扎实的 C 语言功底 + RISC-V 汇编语言",
 "difficulty": 5,
 "hours": "150 小时",
 "summary": "这门课自 2022 年秋季学期起，课程编号由 6.S081 变更为 6.1810，课程内容保持不变。",
 "tags": [],
 "license": "介绍文字 © csdiy.wiki，MIT 许可",
 "intro": {
  "community": "## 课程简介\n\n这门课自 2022 年秋季学期起，课程编号由 6.S081 变更为 6.1810，课程内容保持不变。\n\n麻省理工学院大名鼎鼎的 PDOS 实验室开设的面向MIT本科生的操作系统课程。开设这门课的教授之一 —— Robert Morris 教授曾是一位顶尖黑客，世界上第一个蠕虫病毒 Morris 就是出自他之手。\n\n这门课的前身是 MIT 著名的课程 6.828，MIT 的几位教授为了这门课曾专门开发了一个基于 x86 的教学用操作系统 JOS，被众多名校作为自己的操统课程实验。但随着 RISC-V 的横空出世，这几位教授又基于 RISC-V 开发了一个新的教学用操作系统 xv6，并开设了 MIT6.S081 这门课。由于 RISC-V 轻便易学的特点，学生不需要像此前 JOS 一样纠结于众多 x86 “特有的”为了兼容而遗留下来的复杂机制，而可以专注于操作系统层面的开发。\n\n这几位教授还专门写了一本[教程](https://pdos.csail.mit.edu/6.828/2021/xv6/book-riscv-rev2.pdf)，详细讲解了 xv6 的设计思想和实现细节。\n\n这门课的讲授也很有意思，老师会带着学生依照 xv6 的源代码去理解操作系统的众多机制和设计细节，而不是停留于理论知识。每周都会有一个 lab，让你在 xv6 上增加一些新的机制和特性，非常注重学生动手能力的培养。整个学期一共有 11 个 lab，让你全方位地深刻理解操作系统的每个部分，非常有成就感。而且所有的lab都有着非常完善的测试框架，有的测试代码甚至上千行，让人不得不佩服 MIT 的几位教授为了教好这门课所付出的心血。\n\n这门课的后半程会讲授操作系统领域的多篇经典论文，涉及文件系统、系统安全、网络、虚拟化等等多个主题，让你有机会接触到学界最前沿的研究方向。\n\n## 课程资源\n\n- 课程网站：<https://pdos.csail.mit.edu/6.828/2021/schedule.html>（2021 年秋季版本，与下方中文翻译文档对应；最新一届见 <https://pdos.csail.mit.edu/6.1810/>）\n- 课程视频：<https://www.youtube.com/watch?v=L6YqHxYHa7A>，每节课的链接详见课程网站\n- 课程视频翻译文档：<https://mit-public-courses-cn-translatio.gitbook.io/mit6-s081/>\n- 课程教材：<https://pdos.csail.mit.edu/6.828/2021/xv6/book-riscv-rev2.pdf>\n- 课程作业：<https://pdos.csail.mit.edu/6.828/2021/schedule.html>，11个lab，具体要求详见课程网站\n\n## xv6 补充资源\n\n- [xv6 操作系统的深入讲解](https://space.bilibili.com/1040264970/)\n- [xv6 中文文档](https://th0ar.gitbooks.io/xv6-chinese/content/index.html)\n- [xv6 关键源码逐行解读 + 整体架构分析](https://www.youtube.com/playlist?list=PLbtzT1TYeoMhTPzyTZboW_j7TPAnjv9XB)\n- [课程教材翻译 xv6-riscv-book-zh-cn](https://blog.betteryuan.top/archives/xv6-riscv-book-zh-cn)\n- [课程教材翻译源码 xv6-riscv-book-zh-cn](https://github.com/HelloYJohn/xv6-riscv-book-zh-cn.git)\n\n## 资源汇总\n\n@PKUFlyingPig 在学习这门课中用到的所有资源和作业实现都汇总在 [PKUFlyingPig/MIT6.S081-2020fall - GitHub][github_pkuflyingpig] 中。\n\n@[KuangjuX] 编写了 MIT 6.S081 的 lab 的[题解][solution_kuangjux]，里面有详细的解法和补充知识。另外，@[KuangjuX] 还使用 Rust 语言重新实现了 xv6-riscv 操作系统：[xv6-rust]，里面对于 xv6-riscv 有更为详细的思考和讨论，感兴趣的同学可以看一下哦。\n\n[github_pkuflyingpig]: https://github.com/PKUFlyingPig/MIT6.S081-2020fall\n[KuangjuX]: https://github.com/KuangjuX\n[solution_kuangjux]: https://github.com/KuangjuX/xv6-riscv-solution\n[xv6-rust]: https://github.com/Ko-oK-OS/xv6-rust\n\n### 一些可以参考的博客\n\n- [doraemonzzz](http://doraemonzzz.com/tags/6-S081/)\n- [Xiao Fan (樊潇)](https://fanxiao.tech/posts/2021-03-02-mit-6s081-notes/)\n- [Miigon's blog](https://blog.miigon.net/categories/mit6-s081/)\n- [Zhou Fang](https://walkerzf.github.io/categories/6-S081/index.html)\n- [Yichun's Blog](https://www.yichuny.page/tags/Operating%20System)\n- [解析Ta](https://blog.csdn.net/u013577996/article/details/108679997)\n- [PKUFlyingPig](https://github.com/PKUFlyingPig/MIT6.S081-2020fall)\n- [星遥见](https://www.cnblogs.com/weijunji/tag/XV6/)\n- [tzyt 的博客](https://ttzytt.com/tags/xv6/)\n",
  "communitySource": {
   "kind": "website",
   "label": "csdiy.wiki",
   "url": "https://csdiy.wiki/%E6%93%8D%E4%BD%9C%E7%B3%BB%E7%BB%9F/MIT6.S081/"
  },
  "official": "操作系统工程课程，涵盖系统调用、页表、陷阱、中断和进程调度等核心OS概念。课程通过实际的xv6教学操作系统进行动手实验，同时涉及虚拟内存、文件系统、网络、多核系统和安全等高级主题。",
  "officialSource": {
   "kind": "website",
   "label": "pdos.csail.mit.edu",
   "url": "https://pdos.csail.mit.edu/6.828/2021/schedule.html"
  }
 },
 "links": [
  {
   "kind": "website",
   "label": "网站",
   "url": "https://pdos.csail.mit.edu/6.828/2021/schedule.html"
  },
  {
   "kind": "website",
   "label": "网站",
   "url": "https://pdos.csail.mit.edu/6.1810/"
  },
  {
   "kind": "video",
   "label": "视频",
   "url": "https://www.youtube.com/watch?v=L6YqHxYHa7A"
  },
  {
   "kind": "video",
   "label": "视频翻译文档",
   "url": "https://mit-public-courses-cn-translatio.gitbook.io/mit6-s081/"
  },
  {
   "kind": "textbook",
   "label": "教材",
   "url": "https://pdos.csail.mit.edu/6.828/2021/xv6/book-riscv-rev2.pdf"
  },
  {
   "kind": "assignments",
   "label": "作业",
   "url": "https://pdos.csail.mit.edu/6.828/2021/schedule.html"
  }
 ],
 "modules": [],
 "titleEn": "Operating System Engineering"
}
