{
 "format": "hiana-course@1",
 "slug": "aut1400",
 "title": "Amirkabir University of Technology 1400-2: Advanced Programming Course",
 "category": "编程入门",
 "provider": "Amirkabir University of Technology",
 "instructors": [],
 "language": "C++",
 "prerequisites": "无",
 "difficulty": 5,
 "hours": "50 小时",
 "summary": "无意中发现的一个 C++ 课程。课程的 homework 质量很高，每个 homework 相互独立结构简单，且有完善的单元测试，非常适合用来学习 C++ 的编程。本课程共 7 个 homework，如下所示：",
 "tags": [],
 "license": "介绍文字 © csdiy.wiki，MIT 许可",
 "intro": {
  "community": "## 课程简介\n\n无意中发现的一个 C++ 课程。课程的 homework 质量很高，每个 homework 相互独立结构简单，且有完善的单元测试，非常适合用来学习 C++ 的编程。本课程共 7 个 homework，如下所示：\n\n1. 实现一个 Matrix 类以及相关函数。\n\n2. 实现一个模拟加密货币客户端/服务端执行过程的程序。\n\n3. 实现一个 Binary Search Tree (BST)。\n\n4. 实现 C++ 中的 SharedPtr 和 UniquePtr 智能指针。\n\n5. 使用继承和多态实现多个类。\n\n6. 使用 STL 库解决 4 个问题。\n\n7. 是个 python 项目，有兴趣的可以看看。\n\n没找到课程的主页，只有在 github 有 homework 的源码（名字为 AP1400-2-HW 的那几个）。\n\n## 课程资源\n\n- 课程网站：无\n- 课程代码：<https://github.com/courseworks>\n- 课程教材：无\n- 课程作业：7 homework\n",
  "communitySource": {
   "kind": "website",
   "label": "csdiy.wiki",
   "url": "https://csdiy.wiki/%E7%BC%96%E7%A8%8B%E5%85%A5%E9%97%A8/cpp/AUT1400/"
  },
  "official": "这是一门高质量的 C++ 课程，包含 7 个精心设计的 homework。课程内容涵盖：实现 Matrix 类、加密货币客户端/服务端模拟、二叉搜索树（BST）、C++ 智能指针（SharedPtr 和 UniquePtr）、继承和多态、STL 库的使用，以及一个 Python 项目。每个 homework 相互独立，结构简单，且有完善的单元测试。"
 },
 "links": [
  {
   "kind": "repo",
   "label": "代码",
   "url": "https://github.com/courseworks"
  }
 ],
 "modules": [],
 "titleEn": "Advanced Programming Course"
}
